<?xml version="1.0" encoding="utf-8" ?>
<es:electronics-shop
        xmlns:es="http://www.xmlTechnology.org/electronics-shop-namespace"
        xmlns:xsi="http://www.w3.org/2001/XMLSchema-instance"
        xsi:schemaLocation="http://www.xmlTechnology.org/electronics-shop-namespace electronics-shop.xsd">
    <document-information>
        <author>
            <first-name>≈Åukasz</first-name>
            <last-name>Starosta</last-name>
            <student-id>217862</student-id>
        </author>
        <author>
            <first-name>Piotr</first-name>
            <last-name>Karczewski</last-name>
            <student-id>217846</student-id>
        </author>
        <description>
        This XML document contains an example of an online electronics shop. To the left, there are different categories like manufacturers of the products (e.g. Samsung or Apple) and product types (e.g. mouse or keyboard). To the right, there is a list of all the products in the shop with additional information about them.
        </description>
    </document-information>
    <data>
        <categories>
            <manufacturers>
                <manufacturer manufacturer-id="samsung">
                    <manufacturer-name>Samsung</manufacturer-name>
                    <headquarters>
                        <location>Seul</location>
                        <country>South Korea</country>
                    </headquarters>
                    <factory>Taiwan</factory>
                </manufacturer>
                <manufacturer manufacturer-id="apple">
                    <manufacturer-name>Apple</manufacturer-name>
                    <headquarters>
                        <location>Apple Park</location>
                        <country>United States</country>
                    </headquarters>
                    <factory>China</factory>
                </manufacturer>
                <manufacturer manufacturer-id="oneplus">
                    <manufacturer-name>OnePlus</manufacturer-name>
                    <headquarters>
                        <location>Shenzen</location>
                        <country>China</country>
                    </headquarters>
                    <factory>Taiwan</factory>
                </manufacturer>
                <manufacturer manufacturer-id="razer">
                    <manufacturer-name>Razer</manufacturer-name>
                    <headquarters>
                        <location>San Francisco</location>
                        <country>United States</country>
                    </headquarters>
                    <factory>China</factory>
                </manufacturer>
                <manufacturer manufacturer-id="acer">
                    <manufacturer-name>Acer</manufacturer-name>
                    <headquarters>
                        <location>New Taipei</location>
                        <country>China</country>
                    </headquarters>
                    <factory>China</factory>
                </manufacturer>
                <manufacturer manufacturer-id="asus">
                    <manufacturer-name>Asus</manufacturer-name>
                    <headquarters>
                        <location>Beitou</location>
                        <country>China</country>
                    </headquarters>
                    <factory>Taiwan</factory>
                </manufacturer>
                <manufacturer manufacturer-id="dell">
                    <manufacturer-name>Dell</manufacturer-name>
                    <headquarters>
                        <location>Round Rock</location>
                        <country>United States</country>
                    </headquarters>
                    <factory>China</factory>
                </manufacturer>
            </manufacturers>
            <product-types>
                <product-type category-id="notebook">Notebook</product-type>
                <product-type category-id="smartphone">Smartphone</product-type>
                <product-type category-id="tv">TV</product-type>
                <product-type category-id="monitor">Monitor</product-type>
                <product-type category-id="accessory">Accesory</product-type>
                <product-type category-id="keyboard">Keyboard</product-type>
                <product-type category-id="mouse">Mouse</product-type>
                <product-type category-id="hoverboard">Hoverboard</product-type>
            </product-types>
        </categories>
        <products-list>
            <product product-id="i50" category-id="notebook" manufacturer-id="acer">
                <name>Acer Swift 3</name>
                <price currency="pln" on-sale="no">2000</price>
                <release-date>
                    <day>23</day>
                    <month>1</month>
                    <year>2017</year>
                </release-date>
                <warranty time-unit="years">2</warranty>
                <specification>
                    <weight weight-unit="g">1200</weight>
                    <display-size display_size-unit="inch">13.3</display-size>
                    <color>Silver</color>
                </specification>
                <user-rating>4</user-rating>
                <in-stock>23</in-stock>
                <free-delivery available="available"/>
                <additional-information/>
            </product>
            <product product-id="i51" category-id="notebook" manufacturer-id="apple">
                <name>Apple MacBook Pro</name>
                <price currency="pln" on-sale="yes">3699</price>
                <release-date>
                    <day>3</day>
                    <month>4</month>
                    <year>2018</year>
                </release-date>
                <warranty time-unit="years">2</warranty>
                <specification>
                    <weight weight-unit="g">1050</weight>
                    <display-size display_size-unit="inch">15</display-size>
                    <color>Space Gray</color>
                </specification>
                <user-rating>4.5</user-rating>
                <in-stock>1305</in-stock>
                <free-delivery available="available"/>
                <additional-information>Version with US keyboard layout.</additional-information>
            </product>
            <product product-id="i52" category-id="smartphone" manufacturer-id="samsung">
                <name>Samsung Galaxy S9 Plus</name>
                <price currency="pln" on-sale="no">3299</price>
                <release-date>
                    <day>12</day>
                    <month>11</month>
                    <year>2018</year>
                </release-date>
                <warranty time-unit="years">2</warranty>
                <specification>
                    <weight weight-unit="g">650</weight>
                    <display-size display_size-unit="inch">6.7</display-size>
                    <color>Midnight Black</color>
                </specification>
                <user-rating>4.7</user-rating>
                <in-stock>784</in-stock>
                <free-delivery available="available"/>
                <additional-information>Free wireless charger with every order.</additional-information>
            </product>
            <product product-id="i53" category-id="smartphone" manufacturer-id="apple">
                <name>Apple IPhone X</name>
                <price currency="pln" on-sale="no">3893</price>
                <release-date>
                    <day>14</day>
                    <month>6</month>
                    <year>2018</year>
                </release-date>
                <warranty time-unit="years">3</warranty>
                <specification>
                    <weight weight-unit="g">740</weight>
                    <display-size display_size-unit="inch">5.8</display-size>
                    <color>Rose Gold</color>
                </specification>
                <user-rating>4.4</user-rating>
                <in-stock>2154</in-stock>
                <free-delivery available="available"/>
                <additional-information/>
            </product>
            <product product-id="i54" category-id="notebook" manufacturer-id="dell">
                <name>Dell Inspiron 5379</name>
                <price currency="pln" on-sale="yes">3259</price>
                <release-date>
                    <day>2</day>
                    <month>3</month>
                    <year>2017</year>
                </release-date>
                <warranty time-unit="years">2</warranty>
                <specification>
                    <weight weight-unit="g">1230</weight>
                    <display-size display_size-unit="inch">13.3</display-size>
                    <color>Matte Grey</color>
                </specification>
                <user-rating>4.1</user-rating>
                <in-stock>521</in-stock>
                <free-delivery available="available"/>
                <additional-information>Version with touchscreen.</additional-information>
            </product>
            <product product-id="i55" category-id="keyboard" manufacturer-id="razer">
                <name>Razer Blackwidow Chroma</name>
                <price currency="pln" on-sale="no">549</price>
                <release-date>
                    <day>12</day>
                    <month>10</month>
                    <year>2016</year>
                </release-date>
                <warranty time-unit="years">2</warranty>
                <specification>
                    <weight weight-unit="g">970</weight>
                    <color>Black</color>
                    <switch>Cherry MX Silent</switch>
                </specification>
                <user-rating>4.9</user-rating>